{
  "contract": { "name": "ExploreSourceV1", "version": "1.0.0" },
  "workspaceId": "10000000-0000-4000-8000-000000000001",
  "readinessGoalKey": "goal:foreign-position",
  "readinessGoalId": "30000000-0000-4000-8000-000000000003",
  "targetProfileVersionId": "40000000-0000-4000-8000-000000000004",
  "overlayVersion": "1",
  "catalogVersionKey": "catalog:seed-v1",
  "roadmapVersionKey": "roadmap:seed-v1",
  "targetProfileVersionKey": "target:seed-v1",
  "nodes": [
    {
      "nodeRef": "domain:linux",
      "nodeType": "DOMAIN",
      "title": "Linux",
      "domainRef": null,
      "origin": "CANONICAL",
      "sourceVersionKey": "catalog:seed-v1"
    }
  ],
  "edges": [],
  "positions": [
    {
      "nodeRef": "domain:linux",
      "x": 10,
      "y": 20,
      "workspaceId": "20000000-0000-4000-8000-000000000002",
      "readinessGoalId": "30000000-0000-4000-8000-000000000003",
      "targetProfileVersionId": "40000000-0000-4000-8000-000000000004"
    }
  ],
  "nodeCount": 1,
  "edgeCount": 0
}
